platform,press,keyword,comment
news,기타,김문수,표창장 위조한 조국 일가는 쉴드 치면서 누구는 대학 안 나왔다고 무시하냐? 난 저 위선을 일찌감치 알아챘지만 그동안 방송이며 강단에서 떠들어댔던 말들 하나하나가 다 거짓말이었다는걸 많은 사람들이 좀 깨닫고 느끼기를 바란다~ 위선자들에게 속아 그들이 비호하는 마피아 같은 집안을 대통령실로 보내려 하고 있는 자신들을 좀 돌아보고 각성 해라~
news,기타,김문수,"우리나라 헌법에 연좌제는 없다, 최근에 윤석열이 깽판을 쳐서 또 대선을 하게 되었다, 하지만 윤석열 때문에 사기꾼 범죄자가 대통령이 되면 대한민국이 너무 불행해질것 같다."
news,기타,김문수,저 내란정당것들은 정상이 아님. 아직도 배우자가 대통년인줄 암. 그동안 그렇게 살아와서 그런듯. 오죽 후보자가 내세울게 없으면 포커스를 와이프한테 맞추냐 ㅎㅎ
news,기타,김문수,유시민도 센티멘탈 지적인 전에랑 다르게. 요즘은 과격해졌어!! 꼰대 안되길 바랬는데!!
news,기타,김문수,김문수대통령후보님 설난영여사님 정말 빛나는 분들 입니다.2번 김문수대통령후보님 🎉🎉🎉
news,기타,김문수,"한 가정의 남편, 아버지로서 정말 멋있어 보입니다."
news,기타,김문수,유시민이 선을 넘었음. 항상 공부하려는 모습이 멋지게 보였었는데 이번 발언은 경솔했음.
news,기타,김문수,"설난영, 김문수와 유시민 한번 대질시켜 보라. 한번 누가 옳은 말을 하는지 보련다. 운동권선배 김문수가 투옥시 끝까지 챙겼던 유시민, 전향후 매몰차게 유시민 쌩깐 김문수 부부. 조합위원장이었던 설난영, 엊그제 후보자 부인자격으로 한 행사에서 노조활동을 비하했다던데 말이다."
news,기타,김문수,이죄명 아들을 비롯한 야당넘들의 잇따른 여성 노인비하보도에 국민들은 분노를 넘어 충격에빠져 지지철회가 잇따르고있다!! 정부여당이. 성일종 권성동 김은혀 나경원등 이죄명 특별검증단이 야당넘들의 성범죄를 삿삿이 털어서 낫낫이 까발려 맛대응하면 충분히 김문수후보가 윤대통령의 뒤를이어 자유대한민국을 미래를 이끌수있을것!
news,기타,김문수,유시민 뇌가썩는 전라도공산당
news,기타,김문수,"민주당 노무현재단 이사장으로 입만 열면 약자편, 평등을 내세우면서 설난영여사의 학력과 노동자이력을 조롱하고 비하하는 민주당의 핵심 인사인 유시민이.김혜경의 숙대피아노과가 그리 대단한 학벌인가 상대 부인의 고졸학력과 노동자 이력을 조롱할 만큼"
news,기타,김문수,시민이가 과거 대통령후보자 보고 구구단도 모른다고 지껄여 대더니 가관이다. 진보라는데 완전 가재수준이다.
news,기타,김문수,"비록 김건희여사에 비하면 학력이나 외모는 쪼금 뒤떨어지지만, 천박한 법카여왕 김해경이보단 백배 품격이 낳다!"
news,기타,김문수,유시민 지가 뭐잘난줄 착각..한심한인간 집에가서 발닦고 자라 지구를 떠나거라.~~
news,기타,김문수,유시민 작가여 - 덕을 세우세요. 정치를 떠나 한 인간으로 남의 부인을 그렇게 폄하할 수 있습니까.
news,기타,김문수,SNL은 원래 그런 프로그램이니 김혜경 여사도 출연했으면 될 일이나 유시민이 후보 부인의 학력과 지위를 거론한 것은 비겁하다. 후보 부인이 전과가 있는 것도 아니고 비리가 있는 것도 아닌데 흠 잡으려 겨우 꺼낸 것이 학력이 부족하고 남편을 통해 지위를 향상했다는 그런 이야기.
news,기타,김문수,유시민 다시봤음. 속으로는 그런 생각을 하며 살아온거야? 역시… 선한 척은 하나 속으로는 사람을 그런식으로 나누어 한참 아래로 봤구먼 설난영을 그래도 잚은날 목숨걸고 함께 싸운 동지인데… 딱 선동가 그 이상도 이하도 아닌 일개 위선자 유시민! 이재명이 절대선이라고 해보시지 왜? ㅎㅎ
news,기타,김문수,여윽시 좌파소굴이네 요긴
news,기타,김문수,유시민 지식인인척 포장 하면서 본인은 엄청나게 높은 지위에 있는것 처럼 착각하고 있네요.. 예전에 60이 되면 뇌가 녹는다더라 이런말 했죠. 본인을 돌아보세요 ..설난영씨에게 무슨 열등감 갖고있나요? 참 저급합니다..
news,기타,김문수,권양숙여사는 여상 중퇴다...그러면 중졸인것인데...유시민은 권양숙을 마음속으로 개무시 하겠구나...아! 노무현도 고졸인데...
