platform,press,keyword,comment
news,기타,김문수,머리와 가슴과 입에 저항과 배격이 몸에 밴 부부. 저항은 또 다른 저항과 배격을 끌어 당기는 평법한 원리를 모르는 사람들. 이런 사람들은 지도자로써의 자격이 없다. 제2의 윤썩열이 꼴을 그대로 재현할 것이다. 시름하고 총살 당하는 것은 오롯이 서민들의 몫이된다.
news,기타,김문수,웃기시네 유시민의 인격은 늬들부부보다 백배는 훌륭하다 노조는 못생겼고 지는 이쁘고 부드럽다는 말하는 여자가 훌륭하냐 극우집단 집회에서 막말에 친일발언 하는 김문구가 훌룽하냐 늬들보다 천배는 유시민이 낫다
news,기타,김문수,훌륭은 모르겠고 일단 관상은 ㅈㄴ 쎄한 뱀관상이에요
news,기타,김문수,"국짐 후보가 김문수냐, 설난영이냐?국민들은 그게 궁금했던거다. 하도 배우자가 설치고 다니니까 김건희 시즌 2가 될까봐 두려워서.."
news,기타,김문수,퍽이나
news,기타,김문수,그리 훌륭해서 여성 노동자를 지가 비하했냐. 노조위원장 출신이.
news,기타,김문수,이래서 개그프로그램이 없어 진 이유가 이런 것들 때문이다.
news,기타,김문수,70~80대 노인들이여손주들 지대로 돤 나라 물려주려면 반드시 내란세력들 척결해야지
news,기타,김문수,지는 노조할 얼굴이 아니라는 노조위원장 출신 인간 어디가 훌륭하다는거지? 노조원들 비하 발언 하는 대선 후보 배우자가 정상이야?
news,기타,김문수,말하는거 보니 아니던데 ㅋㅋ 설치는거 보니 건희보다 더 하겠던데 ㅋㅋ 뭔 상관이고 ㅋㅋ 4일만 지나면 일상으로 돌아갈건데 ㅋㅋ 정품 찍어낼려다가 불량품 나온거 맞잔아 ㅋㅋ 국짐것들 ㅋ 폐당될거니까 ㅋㅋ
news,기타,김문수,"암만, 훌륭하지. 노동자들과 다르게 ""부드럽고 이쁘고 문학적이고""~윤거니도 전광훈도 훌륭하지? ㅋㅋ"
news,기타,김문수,노조하는 여자는 과격하고 드세고 못생겼는데 본인(설난영)은 예쁘고 문학적이고 부드러운 여자라며 자기얼굴에 꽃받침을 대며 말하는어이없는 유튜브 영상을 봤다. 이런것은 왜 뉴스에 안나오는가? 인터뷰 마다 김혜경씨 험담하는모난 인성 이더만. 그얼굴로 미모 자화자찬 이라니 자격지심이 보이더라 유시민이 말한건 격 떨어지는쪽을 찝어서 얘기한거이지 싶네. 기막힌 김거니가 가니 설난영이 온다는 얘기가 사실이 될까. 겁나네
news,기타,김문수,유시민씨가 과하게 말은했지만 김문수 부인이 많이 설치긴했지.조용히 선거운동했으면좋으련만
news,기타,김문수,문제는 김문수 당신 같은 사람이 대통령 후보 라는것 이다. 그렇게 극우 집회 다니며 선동질이나 하고 살아온 싸구려 인생이 감히 대한민국 대통령을 꿈꾸다니 … 너무 자존심 상한다. ~!!
news,기타,김문수,관상은 과학이다 마귀할멈같이 생겨서리
news,기타,김문수,프롤레타리아가 부르조아 되면 적어도 그 과거의 정체성을 부정하거나 폄하해서는 안되겠지요.유시민작가는 당신들의 과거를 가장 잘아는 지인으로서 변절한 당신들의 삶과 노동운동 조차도 가벼이 보는 모습에서 안타까운 일언이겠지요.
news,기타,김문수,아주머니 남 욕하시기 전에 거울부터 보시죠
news,기타,김문수,기사 헤드라인 뿐 아니라 실제 발언의 맥락을 좀 보세요~ 그리고 사실 후보 배우자가 이렇게 적극적으로 네거티브 언행하는 거 처음이긴 한거 같아요..
news,기타,김문수,어? 이상하다. 국힘당에서 이재명 사모에 대해서는 더하지않았나?
news,기타,김문수,훌륭한 사람은 가만히 있는 상대후보 부인 비난하지 않는다 훌륭한 사람이 시비를 먼저 걸고 싸움을 부추기지 않는다 그런건 나쁜사람이라고 정의한다
news,기타,김문수,김문수 기준에서는 훌륭하겠지
news,기타,김문수,노조위원장 했다면서 노조를 못생겻다라고 하다니?
news,기타,김문수,그렇지 참 훌륭해서 노조처럼 생긴사람 이라고 비꼬고 다니지
news,기타,김문수,운동권 노조 먹튀하고 국짐당 편에서서 내란 동조 하는게 훌륭하다는 건가? 친일파 스럽네
news,기타,김문수,틀린.말 없던디 국민이 판단하는 거지
news,기타,김문수,여기 석렬이 다음으로 부부가 사기꾼 탄생했네 둘다 거짖말을 밥먹듯이하네
news,기타,김문수,아무리 설씨가 쏘우같이 생겨서 설치고 다녔다해도 이번만큼은 유작가의 불찰이 맞다. 빨리 사과하고 매듭짓길
news,기타,김문수,똥싸고있네 그래서 니 잡혀 구금되었을때 온힘으로 도와준 사람 뒤통수 까고있냐?
news,기타,김문수,노조욕했는데 훌륭한사람이라고? 그냥 김거니 시즌2임 직쏘 아지매
news,기타,김문수,사이비에 기웃기웃 하면서 깨끗한 척 하기는~!
news,기타,김문수,김어준 유시민 조국비호패거리... 지난대선때도 조국비호하면서 굥당선의 일등공신이 되더니... 나라를 요모양요꼴 개판으로 만들어놓고 아직도 정신을 못차리고...또 자살골을 넣고 있네...
news,기타,김문수,그러니까 나대지마라 건희처럼 나대니까 ! 발을 땅에 붙이고 다녀라
news,기타,김문수,수문이는 좋겠다 아내가 너어무 이뻐서 둘이 손잡고 한적한 곳에서 깨소금 볶고 살길
news,기타,김문수,"그 정도는 국민 누구나 말할 수 있고, 실제 그렇게 생각하는 국민들도 있다. 대선 후보로 나선 자의 숙명으로 여기고 대범하게 넘겨라."
news,기타,김문수,"너같은 여자가 훌륭해? 이거 뭐…말문이 막히네. 내란옹호에 배신의 아이콘이. 출세에 눈멀어서..,"
news,기타,김문수,저거 내란수괴놈이 지 부인 감싼답시고 치던 헛소리랑 똑같네
news,기타,김문수,변절자 웃기지마라
news,기타,김문수,"ㅋㅋ 팔불출 인가, 석열 씨 한테 물어도 훌륭한 아내라 할걸...."
news,기타,김문수,촉새가 또 설설 날아 당기는구먼 이제는 어디 앉을자리가 있을려나 털을 확뽑아 버리기전에 조용히 있어요
news,기타,김문수,김문수에게 만 이겠지 우리가보기엔 김건희를 다시 보는줄 적당히 나댔어야지 특히 마이크에 상대후보 부인을 대노코 디스하는건 역대 첨인듯 보기흉했음
news,기타,김문수,쌍으로 꼴값하네
news,기타,김문수,부창부수 노동운동을 수단과 목적으로 사용것들일뿐 그입 다물어라
news,기타,김문수,"뭐 그닥 틀린 말은 아닌거 같은데,"
news,기타,김문수,노동운동하다가 함께 감빵도 갔는데 동지들 배반해서 살림 많이 늘었냐!
news,기타,김문수,봉건시대 엔 왕비요. 공화국 시대는 국모. 영 부인이신데 사모님은 대통령을 내조만 잘하시고 국내외 정치엔 일절 관여하지 말아야 한다. 하면 할수록 왜곡되어 정권이 피폐 무너진다. 윤석열 정권 처럼. 설 여사님도 저기 뒷전에 계시길
news,기타,김문수,국짐은 후보자와 그 가족을 비방한 이준석은 잘한다더니?
news,기타,김문수,ㅋㅋ. 찍소
news,기타,김문수,사전투표 마치고 왔습니다. 출국금지 출국금지! ㅋㅋㅋ
news,기타,김문수,김건희 가 윤석열 을 설난영은 김문수를 사랑이라는 이름으로 서로 괴물로 만들었다 그릇만큼만 담아야한다 지금넘친다 넘쳐
news,기타,김문수,"시민아 상정이좀 닮아라 좋은사람 인정할건 인정해야지,,민주화운동할때 독재고문에 너부터 모두 불어버리고 김문수만 끝까지 고문받으며 상정이를 지켰단다,그래서 상정이가 존경하는사람 중에 한분이란다,니들은머냐 의리없는인갼들,림죵석,김민서기,추미 ㅇ,뮹가,이해 차니,유시미니,등등등~~"
news,기타,김문수,지가 김혜경 욕 하는건 괜찮고...와이프 욕 먹는건 듣기 싫은가 봐. 그러게 행실을 똑바로 하고 다니지. 어디 얼탱을 하고 다녀 그 얼굴로...김문수가 설난영이고 설난영이 김문수면 김건희 보다 100배 더 하겠네 긁힌 건 알겠는데 자중해라
news,기타,김문수,아내가 훌륭하게 생겼네 ㅋㅋㅋㅋㅋㅋㅋㅋㅋㅋㅋㅋㅋㅋㅋㅋㅋㅋㅋㅋㅋㅋㅋㅋㅋㅋㅋㅋㅋㅋㅋㅋㅋㅋㅋㅋㅋㅋㅋㅋㅋㅋㅋㅋㅋㅋㅋㅋㅋㅋㅋㅋㅋㅋㅋㅋㅋㅋㅋㅋㅋㅋㅋㅋㅋㅋㅋㅋㅋㅋㅋㅋㅋㅋㅋㅋㅋㅋㅋㅋㅋㅋㅋㅋㅋㅋㅋㅋㅋㅋㅋㅋ 생긴건 과학이다 ㅋㅋㅋ
news,기타,김문수,"(어떤 사람은) 살다보면 자신의 명분에 취해 검사 사칭도 할 수 있고, 육욕에 빠져 총각행세를 할 수도 있다. 다들 은밀한 죄도 많이 지으니… 그 자체로 돌을 던지려는 게 아니다. 하지만!!!! 그런 사람이 대통령의 자리에 가는 건 완전히 다른 얘기다. 그뿐이랴. 그 아들은 또 어떡고. 제발 정신 잘 차리고 투표하자… 윗물이 맑아야 아랫물이 맑다. 대한민국 국민들아 제발…"
news,기타,김문수,"다른 후보 배우자 뒷담화한거 설난영씨가 먼저해서 이 사단이 난거죠. 불교행사때 이재명대표 사모님과 인사 나누라는데 엄청 띠꺼운 표정하면서 억지로 악수하는거 티났어요. 경기도지사때부터 인연이 있었다던데 왜 저래 했는데 얼마 안있어서 인신공격 하시더라고요. 그때 포문을 열어놓고 그땐 아무도 비판 안하더라고요.ㅎ 외모보고 머라하는것도 본인이 먼저, 노조할 얼굴 아니지 않냐며 노조하시는 분들 비하하셨죠. 정말 비호감이다 싶었네요."
news,기타,김문수,구구절절이 맞는 말씀입니다...
news,기타,김문수,"둘 다 정상이 아닌 듯 한테요.. 그냥 할머니,할아버지로 사세요.. 정치 그만 하시고요.. ㅠㅠ"
news,기타,김문수,적반하장
news,기타,김문수,혐오의 발언을 당한 피해자 설난영씨를 욕하는 꼴이라니... 그쪽 지지자들 이중성이 대단하시네
news,기타,김문수,"남의 인생을 ‘갈 수 없는 자리’라며 평가절하하는 모습은 한심하기 그지없습니다. 그런데 얼마 전에는 이재명 아들이 저지른 문제를 ‘대통령 될 사람이니까 욕먹는 것’이라며 사실상 두둔하는 위선까지 보였죠? 잘못은 잘못인 건데, 왜 특별히 감싸고 변명하는지 이해할 수 없습니다. 이런 이중잣대와 편파적 태도야말로 스스로 ‘제정신이 아니다’는 걸 증명하는 꼴입니다."
news,기타,김문수,"노동자를 대변하는 당인것처럼 위선을 떨지만 속내는 ""찐노동""자를 저급하다고 생각하는 인간들... 사실 민노총, 페미를 정치세력으로 이용하는거지 실제 노동자와 여성을 위한다는 것들이 저런말을 내뱉고 아들의 음란성 댓글에 성매매업소 후기에는 입꾹"
news,기타,김문수,"자신의 처지가 바뀌니, 전에 자신의 처지에서 함께 했던 사람들 혐오하는건 개구리들이 하는짓이죠!설익은 노동운동가들은 역사적국가생산책임자(대의적노동자)와 생계의 책임자(구체적역할의 노동자), 이 두역할이 상반된것으로 무식하게,이해하지 못하고 노동자(대한민국의 약2800만)를 배신하고 노동자를 혐오하는데 심지어 이혐오를 선동하는데앞장서기까지합니다. 이번 내란 조기대선에서 그 실제인물 김문수 설난영를 우리는 마주하고 확인하는 역사적 경험을 합니다. 무식한이해와 배신은 필연적으로 결합되어있음을 노동과 사회적평균이윤의관계로논증해보겠습니다."
news,기타,김문수,법카로 소고기 초밥 과일을 먹어 치우진 않았잖아
news,기타,김문수,조롱하고 모욕하고 비난하는건 국민의짐 전문인데
news,기타,김문수,그래서 노동운동하다가 국힘이냐
news,기타,김문수,2찍들은 배우자 선택하는거야? 쥴리모시더니 정신이 나갔네 다들
news,기타,김문수,트집하나 잘 잡은 것처럼 나불거리는데 유시민은 정치인도 아니고 민주당 당원도 아닌데........평범한 대한민국 국민이면서 직업이 작가인데 무슨 말을 못하지 언론 출판 집회 결사의 자유가 있는데......
news,기타,김문수,선거법 위반한것 없고 유시민이 바른말 했구만 고발은 윤석열과 김건희를 고발해야지 그래야 지지율 올라가지...
news,기타,김문수,부끄러움을 모르는 부부
news,기타,김문수,아줌씨 왜케 나대요? 거니도 영부인 호칭도 안써~ 내조만 열심히 한다고 하고는 그렇게 니댔지만 아줌씨만큼 똥ㆍ오줌 못가리고 투표전부터 셜쳐대지는 않았지~~ 거니보다 더하면 더했지 덜하지는 않을 듯~ 제발 찌그러져 계셔요~ 보기 거북합니다~
news,기타,김문수,대통령 이재명정부 국무총리 유시민 내정자가 될수도 있다 비상계엄 내란수괴 우두머리 졸개들아 지금 국민들이 너거들 내란 세력들 돌아오지 못 하게 투표 하는 것이다
news,기타,김문수,노조를 비하하는 훌륭한 부인 그 남편 딱 내란좀비네
news,기타,김문수,"옛날의 김문수, 설난영을 얘기하는게 아니다. 현재를 얘기하는 거지. 기억만 존재할 뿐 지금은 전혀 다른 인간들이 되었다."
news,기타,김문수,윤썩열 짝 나겠네 마눌 지키려 나라 망치더니
news,기타,김문수,촉새야 덕분에 1번에서 2번으로 옮겼다~!~
news,기타,김문수,"아내는 훌륭한 사람,, 훌륭한 사람 절대 아냐~ 과격하고 여러모로 진짜 못생겻드라"
news,기타,김문수,설난영씨가 먼저 자신은 노조안했다며 ~ 노조는 못생기고 세고 자신은 예쁘고~
news,기타,김문수,둘이 서로 훌륭하다고 자화자찬 오지네...칭찬도 남이해야지. 전광훈이나 쫓아다니면서 무슨 대통령을 하겠다고....국힘은 하나같이 이상해. 극우 아니면 전광훈 아니면 펨코임?
news,기타,김문수,윤석열도 김건희는 훌륭한사람이라고 생각할껄 ㅋㅋ
news,기타,김문수,유시민이 김문수 감옥에 있을 때 설난영과 함께 구명을 운동을 했는데 농성장에서 같이 숙식을 할 정도로 정성을 다했다고 한다. 그런데 김문수가 보수당 국회의원이 되자 유시민의 전화를 피하더란다. 극우 뉴라이트 매국적인 역사관 전광훈 승배자 윤석열 하수인은 심판 받아야 한다.
news,기타,김문수,너무 똑부러지게 생겨서 눈을 못 찾겠는데?
news,기타,김문수,"먼저 설난영이 어쩌고 다녔는지를 생각해봐. 그 모습을 보니 그렇게 평가됐던 거야. 그사람이 후보부인에 걸맞게 정상적으로 행동했다면 그런얘기 안나올건데, 굳이 이해해보려고 하니까 그런 역학관계안에서 그런 태도가 나오는 거라고 논평을 한거지"
news,기타,김문수,쫘아아빨들은 모조리 능지처참 척살. 단두대로 보내야 할것이다 반드시 멸해야 할것이다
news,기타,김문수,유시민 사이다 ㅎㅎㅎㅎ
news,기타,김문수,"유시민이 착각한거예요. 김어준방송을보니 ""다들 좋은 대학 나왔잖아요."" 하면서 96년도에 독일에서 김문수후보가 국회의원 당선되었을때 축하 전화했는데 김문수후보 배우자가 ""네,네, 고맙습니다.""하더라, 사무적이다. 이런 표현하는데 상대방 감정, 분위기를 아나? 면전도 아니고 전화로 상대방의 자기를 무시한다는 생각, 직접 물어봤어야죠? 그걸갖고 소통단절하고 폄하하고 헐뜯고,, 너무 어리석어요. 속된말로 멍청한 행동입니다. 언능 물어보세요. 어느 국회의원이 당선되었다고 목에 힘주나요? 더구나 경기도지사시절 법카소동도 없잖아요."
news,기타,김문수,"놀랍지도 않은 좌파들의 이중성. 서민 위하는 척, 노동자 편인 척 하는건 선거 때 뿐 아닌가? 공개적으로 저렇게 노동자를 폄하하고 무시하고 급 나누는게 좌파의 본질이다."
news,기타,김문수,유시민씨가 민주당원도 아니고 대선 후보도 아닌데 왜 투표로 심판을 하라는건지 모르겟네....정작 윤석열 이야기 나오면 탈당한 사람이라 할말 없다면서... 내로남불의 정석인듯..
news,기타,김문수,유시민의 혀가 언젠가 스스로 무덤을 파는 일이 생기지. 인생. 60넘으면. 혀를 함부로 놀리지 말아야지
news,기타,김문수,개눈에는 뭐만보인다더니 변절부부 역겹다
news,기타,김문수,"배우자의 삶을 존중하고, 함께 걸어온 길을 귀하게 여기는 마음은 본받을만 하다."
news,기타,김문수,김푼수의 개소리..!!
news,기타,김문수,그래 문수야 니마누라 훌륭하다 니는들어가고 니 마누라 후보로 내세워라 부끄러운줄도 모르고 ㅉ ㅉ
news,기타,김문수,유시민 작가님의 발언은 적절하지 않아보이네요
news,기타,김문수,"노동자였던자가 노동자를못생겼다고하는 발언은?! 품위도없이 상대후보자배우자를 비하한다는것이 더 문제급이다!!쯧쯧,김문수 배우자가 먼저 노동자를비하해놓고 이런글을 올리고싶냐!"
news,기타,김문수,관상은 과학이다 어째 쌔~한!!!!!!!!
news,기타,김문수,광대뼈
news,기타,김문수,과거 노동자 편에서서 운동한거 뼈저리게 후회한다며... 먼소리인지 당췌
news,기타,김문수,유시민이 말은 항상 옳다. 바른말을 해도 고발하냐?
news,기타,김문수,부부는 닮는다더니 ㅉㅉ
news,기타,김문수,맞는말 아닌가? 노조얘기하며 이쁘고 못나고 비하한게 누군데? 어째 빨간애들은 다저러냐?
news,기타,김문수,카리나 같이 예쁜 여성은 x고 싶다 꽂고 싶다 별소리를 다하면서. . . 여성 외모 따지는 놈들이 자기들 기준에 안 맞으면 외모 비하 부터 시작해서 온갖 여성혐오는 다 늘어 놓음. 이걸 지지하는 개딸들은 실제로 좌좀 남성들이 자기들은 쳐다보지도 않는다는걸 모르는지.
news,기타,김문수,윤석렬이보다 더 마누라 챙기는것보니 더하면 더하지? 건희한테 질려서설씨 나오는것 자체가 혐오스럽다
news,기타,김문수,설난영이 깝치고 다니던지 말던지 뭐하러 신경쓰나? 그냥 내버려 둬..
news,기타,김문수,설난영 쏘우 캐릭터 닮았다 진짜
news,기타,김문수,이번 대선은 좀 아내 얘기좀 빼면 안되니?그래서 어쩌자구 김건희처럼 가보게? 배우자 토론을 하자고 하질않나 제발 좀 피곤하다
news,기타,김문수,훌륭 아니고 흉해요
news,기타,김문수,유시민이 비방할때 그 목소리와 깐족거림 ㅠ
news,기타,김문수,그럼게 상대방을 비방하더니 본인들은 조금만 긁혀도 생난리
news,기타,김문수,암요~ 예쁘고 문학적이고 부드러운~ 노조하실분 같이 생기셨어요~
news,기타,김문수,멀 그리길게말하냐 부창부수고 초록은동색이고 이빠이는가득이잖아
news,기타,김문수,개문수야 국민들이 아니라는데 또 우기니?
news,기타,김문수,부창부수네. 이번 선거를 끝으로 내 눈앞에 띄지 마라. 세상 더러운 짓 다 해놓고 청렴한 척 어이가 없다. 불법 후원자금 쪼개기 수령 의혹이나 밝혀라!
news,기타,김문수,난 별로 ~ 그다지 ~ ㅋ
news,기타,김문수,남깔땐 자기도 까일생각은 못한건가?
news,기타,김문수,대깨 는 입닥해. 뇌 없는 내로남불 것들이 ㅎ김문수 마누라가 잘못했어도 니들은 겸손하게 들어. 똑같은 것들이니까
news,기타,김문수,인상이 과학이다
news,기타,김문수,대통령이던 배우자던 외모는 중요하지 않은것 같아요 ㆍ단정하고 인성 바르고 성실히 살았으면 된것같은데요ㆍ
news,기타,김문수,그럼 내 아내는 형편없는 사람이오!하는 사람이 어딨냐 ㅉㅉㅉ
news,기타,김문수,이성을 잃은사람들로 가득하구나..
news,기타,김문수,문재인은 xx이라고 말한인간도 무죄나왔는데?? 하기야 요즘 판사들은 지 맘대로 판결하니~~그래놓고 법과원칙대로 ㅎㅎ?? 기소기한을 시간으로 계산해서 구속피의자를 풀어주고 잘했다고~~그러는판사도 있는데 유작가도 기소될수도~~
news,기타,김문수,부인이 전라도사람 이라고 했다가 시민들에게 언제 니가 여기왔었냐고 꾸지람듣고 도망감
news,기타,김문수,유시민은 틀린말 안하다 찍쏘가 잘못했네
news,기타,김문수,남에 행동이나 남을 지적하려면 나부터 돌아보고 지적해라 대한민국 남자 중에 네 마누라 소중하지 않은 사람 없다
news,기타,김문수,노조를 비하하며 자신의 과거를 숨기려고한 설씨 본인이 가장 큰문제이고 이상한거 아님? 당신들이나 똑바로 하라! 고소남발하지말고!
news,기타,김문수,"둘다 어디 북한에서 온것같다. 극죄에서 극우로 갔으면 살만큼 좀 나아지지 않았나? 그리고 유시민이 누가 인성을 말했냐? 뭘 듣고 말해. 관계가 틀어진걸 말한거지. 위치가 바뀌어서 뻣뻣하게 나오면 그전에 알던 사람들하고 선긋자는 시인인걸 빨리 알아채고 물러났단 거잖아. 쟤들은 귀도 멀고 눈도 멀고, 사실하나 제대로 파악못하면서 무슨 공직을 한가고 하나같이 모지리니"
news,기타,김문수,마귀할멈 사과? 백설공주 스토리냐?
news,기타,김문수,소방관이 김문수고 김문수가 소방관이었어야지. 이제와서 아무리 애를 써도 소용없다.
news,기타,김문수,노동운동과 학생운동 하던 사람이 변절을 하면 저렇게 추잡하고 가증스러워 진다는걸 여러분들은 보고 계십니다.
news,기타,김문수,예쁘고 문학적인 사람이 맞다고? ㅋㄲㅋ 노조 폄훼하더니 지는 좋은 소리만 듣고 싶은가보네 제2의 김건희 맞네
news,기타,김문수,훌륭해서 노조에게 막말 했내!!??? 친일 내란동조당 국짐당 김문순대 놈아!! 너도 훌륭해서 119에 갑질 한거냐!!??? 김문순대욕!!!
news,기타,김문수,후보자 비방죄는 '선거운동을 위하여' 라는 단서조항이 있다. 유시민작가의 발언이 부적절했다고 보이지만 유작가는 민주당 당원도 아니고 선거운동을 하지 않는 평론가의 관점에서 얘기한 것 뿐이다. 국힘당은 쟁점화시키기 위해 고발조치 등을 하는 것이겠지만 아무 소용 없다.
news,기타,김문수,감히 유시민은 넘볼 수 없는 게 김문수다.. 유시민은 학생운동 시절 체포되었으나 다음날 아침 바로 멀쩡이 나왔다. 바로 그날 학생운동 조직원 전원 체포되었다.. 김문수는 유시민의 동생과 함께 체포되어 온갖 고문을 견디며.조직원 심상정 을 보호했다.
news,기타,김문수,유시민은 일반 작가인데??? 정치인도 아닌데??공당이 왜저럴까??? 개인의 의사표현??
news,기타,김문수,네 자칭 미인인 와이프 있어서 좋겠습니다. ㅎㅎ
news,기타,김문수,차마 니 주됑이로도 니 마누라가 예쁘다고는 못하겠지? 니마누라 안경 좀 맞춰줘라.
news,기타,김문수,외모 비하는 아니지만 계속 보고싶은 얼굴은 아님
news,기타,김문수,모르는 사이가 아니니 유시민이 잘 알겠지
news,기타,김문수,노조위원장 했던 당신 부인은 노조하는 사람들은 못생겼다며? ㅋㅋㅋ 그럼 당신부인도 못생긴거 맞지? 지들이 했던 말은 참 수준높은 말이기도 햇나보다.
news,기타,김문수,"설난영의 최근 행보와 말이 부적절했다는 것만 말해도 충분했는데, 유시민 답지 않은 발언이었습니다."
news,기타,김문수,김문수 당신은 당신 아내와 함께 변절자! 그 괜찮던 너희가 악마화 되다니
news,기타,김문수,맞는 말 이던데ㅡ
news,기타,김문수,대통령 후보 배우자라는 자리에 갈수 있는 인생은 뭔데? 골때리네. ㅎㅎㅎㅎ
news,기타,김문수,응 니말이 맞어. 소방공무원 갑질한 빤스 수제자인 니가 대선후고 보수여당이 이제 야당되면 당대표가 극우테러분자가 대표되는 TKPK당 클라스의 미래 ㅋㅋㅋ
news,기타,김문수,"김덕수, 을지문덕으로 사기친 놈이 훌륭하다고 하는 사람이니 알만하네."
news,기타,김문수,김문수가 다른건.다 쓸데가 없는데 딸자식 하나는 잘둔것 같이 보인다 사회복지사로.열심히 살아가는 얼굴에 진심이 보여 좋았다 애쓰셨네요 잘한건 잘한거니까
news,기타,김문수,훌륭하기는...망상에젖어계시더만
news,기타,김문수,남편과 아내 동일시해서 망한 권력이 바로 앞에 있는데 정신차려 투표해야 할 듯.
news,기타,김문수,나쁜놈이 훌륭하다고 평가하면 뻔하잖아. 윤석렬도 죄가 없다는 놈인데.
